{
  "id": "a3f9c21be0d4",
  "project": "example-app",
  "system": "db",
  "layer": "INFRA",
  "source": "infra-probe",
  "pack": "supabase@1.2.0",
  "ruleId": "supabase/auth/anon-signups-open",
  "title": "Anonymous sign-ups enabled on a production Auth instance",
  "severity": "HIGH",
  "confidence": "HIGH",
  "cwe": ["CWE-284"],
  "class": "verified",
  "location": { "host": "192.0.2.10", "service": "supabase-auth", "setting": "GOTRUE_DISABLE_SIGNUP" },
  "evidence": "GOTRUE_DISABLE_SIGNUP=false in the running container env (value redacted class: config)",
  "exploitScenario": "Anyone who can reach the Auth endpoint can create an account and obtain an authenticated session.",
  "preconditions": "The Auth endpoint is reachable from the public internet.",
  "recommendation": "Set GOTRUE_DISABLE_SIGNUP=true and invite users explicitly.",
  "verification": { "verifiers": 2, "confirmed": 2, "run": "2026-10-23T18-02-11Z" },
  "status": "open",
  "firstSeen": "2026-10-23T18:02:11Z",
  "lastSeen": "2026-10-23T18:02:11Z",
  "fixedIn": null,
  "externalIds": { "claudeSecurityPluginFindingId": null, "cve": null }
}
